{
  "$schema": "https://json-schema.org/draft/2020-12/schema",
  "type": "object",
  "additionalProperties": true,
  "properties": {
    "type": {
      "type": "array",
      "readOnly": true,
      "default": ["DigitalIdentityAnchor", "VerifiableCredential"],
      "items": {
        "type": "string"
      },
      "allOf": [
        {
          "contains": {
            "const": "DigitalIdentityAnchor",
            "minContains": 1
          }
        },
        {
          "contains": {
            "const": "VerifiableCredential",
            "minContains": 1
          }
        }
      ]
    },
    "@context": {
      "example": ["https://www.w3.org/ns/credentials/v2", "https://test.uncefact.org/vocabulary/untp/dia/0.6.1/"],
      "type": "array",
      "items": {
        "type": "string"
      },
      "description": "A list of JSON-LD context URIs that define the semantic meaning of properties within the credential. ",
      "readOnly": true,
      "prefixItems": [
        {
          "const": "https://www.w3.org/ns/credentials/v2",
          "type": "string"
        },
        {
          "const": "https://test.uncefact.org/vocabulary/untp/dia/0.6.1/",
          "type": "string"
        }
      ],
      "default": ["https://www.w3.org/ns/credentials/v2", "https://test.uncefact.org/vocabulary/untp/dia/0.6.1/"],
      "minItems": 2,
      "uniqueItems": true
    },
    "id": {
      "example": "https://example-company.com/credentials/2a423366-a0d6-4855-ba65-2e0c926d09b0",
      "type": "string",
      "format": "uri",
      "description": "A unique identifier (URI) assigned to the product passport. May be a UUID"
    },
    "issuer": {
      "$ref": "#/$defs/CredentialIssuer",
      "description": "The organisation that is the issuer of this VC. Note that the \"id\" property MUST be a W3C DID.  Other identifiers such as tax registration numbers can be listed in the \"otherIdentifiers\" property."
    },
    "validFrom": {
      "pattern": "^-?([1-9][0-9]{3,}|0[0-9]{3})-(0[1-9]|1[0-2])-(0[1-9]|[12][0-9]|3[01])T(([01][0-9]|2[0-3]):[0-5][0-9]:[0-5][0-9](\\.[0-9]+)?|(24:00:00(\\.0+)?))(Z|(\\+|-)((0[0-9]|1[0-3]):[0-5][0-9]|14:00))$",
      "example": "2024-03-15T12:00:00Z",
      "type": "string",
      "format": "date-time",
      "description": "The date and time from which the credential is valid."
    },
    "validUntil": {
      "pattern": "^-?([1-9][0-9]{3,}|0[0-9]{3})-(0[1-9]|1[0-2])-(0[1-9]|[12][0-9]|3[01])T(([01][0-9]|2[0-3]):[0-5][0-9]:[0-5][0-9](\\.[0-9]+)?|(24:00:00(\\.0+)?))(Z|(\\+|-)((0[0-9]|1[0-3]):[0-5][0-9]|14:00))$",
      "example": "2034-03-15T12:00:00Z",
      "type": "string",
      "format": "date-time",
      "description": "The expiry date (if applicable) of this verifiable credential."
    },
    "credentialSubject": {
      "$ref": "#/$defs/RegisteredIdentity",
      "description": "The registered identity from the authoritative register that is the subject of this credential"
    }
  },
  "description": "The Digital Identity Anchor (DIA) is a very simple credential that is issued by a trusted authority and asserts an equivalence between a member identity as known to the authority (eg a VAT number) and one or more decentralised identifiers (DIDs) held by the member.  ",
  "required": ["@context", "id", "issuer"],
  "$defs": {
    "CredentialIssuer": {
      "type": "object",
      "additionalProperties": false,
      "properties": {
        "type": {
          "type": "array",
          "readOnly": true,
          "default": ["CredentialIssuer"],
          "items": {
            "type": "string"
          },
          "allOf": [
            {
              "contains": {
                "const": "CredentialIssuer",
                "minContains": 1
              }
            }
          ]
        },
        "id": {
          "example": "did:web:identifiers.example-company.com:12345",
          "type": "string",
          "format": "uri",
          "description": "The W3C DID of the issuer - should be a did:web or did:webvh"
        },
        "name": {
          "example": "Example Company Pty Ltd",
          "type": "string",
          "description": "The name of the issuer person or organisation"
        },
        "issuerAlsoKnownAs": {
          "type": "array",
          "items": {
            "type": "object",
            "properties": {
              "id": {
                "example": "https://abr.business.gov.au/ABN/View?abn=90664869327",
                "type": "string",
                "format": "uri",
                "description": "The globally unique ID of the party as a URI, ideally as a resolvable ID. "
              },
              "name": {
                "example": "Sample Company Pty Ltd.",
                "type": "string",
                "description": "The registered name of the party within the identifier scheme."
              },
              "registeredId": {
                "example": 90664869327,
                "type": "string",
                "description": "The registration number (alphanumeric) of the Party within the register. Unique within the register."
              }
            },
            "required": ["id", "name"]
          },
          "description": "An optional list of other registered identifiers for this credential issuer "
        }
      },
      "description": "The issuer party (person or organisation) of a verifiable credential.",
      "required": ["id", "name"]
    },
    "RegisteredIdentity": {
      "type": "object",
      "additionalProperties": true,
      "properties": {
        "type": {
          "type": "array",
          "readOnly": true,
          "default": ["RegisteredIdentity"],
          "items": {
            "type": "string"
          },
          "allOf": [
            {
              "contains": {
                "const": "RegisteredIdentity",
                "minContains": 1
              }
            }
          ]
        },
        "id": {
          "example": "did:web:samplecompany.com/123456789",
          "type": "string",
          "format": "uri",
          "description": "The DID that is controlled by the registered member and is linked to the registeredID through this Identity Anchor credential"
        },
        "name": {
          "example": "Sample business Ltd",
          "type": "string",
          "description": "The registered name of the entity within the identifier scheme.  Examples: product - EV battery 300Ah, Party - Sample Company Pty Ltd,  Facility - Green Acres battery factory"
        },
        "registeredId": {
          "example": 123456789,
          "type": "string",
          "description": "The registration number (alphanumeric) of the entity within the register. Unique within the register."
        },
        "idScheme": {
          "$ref": "#/$defs/IdentifierScheme",
          "description": "An identifier registration scheme for products, facilities, or organisations. Typically operated by a state, national or global authority."
        },
        "registerType": {
          "type": "string",
          "enum": ["Product", "Facility", "Business", "Trademark", "Land", "Accreditation"],
          "example": "Product",
          "description": "The thematic purpose of the register - organisations, facilities, products, trademarks, etc"
        },
        "registrationScopeList": {
          "type": "array",
          "items": {
            "type": "string",
            "format": "uri"
          },
          "description": "List of URIs the represent the role/scopes of membership for the register. For example [\"https://abr.business.gov.au/Help/EntityTypeDescription?Id=19\"]"
        }
      },
      "description": "The identity anchor is a mapping between a registery member identity and one or more decentralised identifiers owned by the member. It may also list a set of membership scopes.",
      "required": ["id", "name"]
    },
    "IdentifierScheme": {
      "type": "object",
      "additionalProperties": false,
      "properties": {
        "type": {
          "type": "array",
          "readOnly": true,
          "default": ["IdentifierScheme"],
          "items": {
            "type": "string"
          },
          "allOf": [
            {
              "contains": {
                "const": "IdentifierScheme",
                "minContains": 1
              }
            }
          ]
        },
        "id": {
          "example": "https://id.gs1.org/01/",
          "type": "string",
          "format": "uri",
          "description": "The globally unique identifier of the registration scheme. The scheme should be registered and discoverable from vocabulary.uncefact.org/identifierSchemes"
        },
        "name": {
          "example": "Global Trade Identification Number (GTIN)",
          "type": "string",
          "description": "The name of the identifier scheme. "
        }
      },
      "description": "An identifier registration scheme for products, facilities, or organisations. Typically operated by a state, national or global authority."
    }
  }
}
