{
  "type": ["DigitalFacilityRecord", "VerifiableCredential"],
  "@context": ["https://www.w3.org/ns/credentials/v2", "https://vocabulary.uncefact.org/untp/dfr/0.3.10"],
  "id": "https://example-company.com/credentials/2a423366-a0d6-4855-ba65-2e0c926d09b0",
  "issuer": {
    "type": ["CredentialIssuer"],
    "id": "did:web:identifiers.example-company.com:12345",
    "name": "Example Company Pty Ltd"
  },
  "validFrom": "2024-03-15T12:00:00Z",
  "validUntil": "2034-03-15T12:00:00Z",
  "credentialSubject": {
    "type": ["Facility", "Entity"],
    "id": "https://id.gs1.org/gln/0614141123452",
    "name": "Example facility 7",
    "locationInformation": {
      "type": ["Location"],
      "geoLocation": {
        "type": "Point",
        "coordinates": [149.1283, -35.283]
      },
      "geoBoundary": {
        "type": "Polygon",
        "coordinates": [
          [
            [149.1283, -35.283],
            [149.1293, -35.284],
            [149.1288, -35.282],
            [149.1283, -35.283]
          ]
        ]
      }
    }
  }
}
