{
  "type": [
    "DigitalConformityCredential",
    "VerifiableCredential"
  ],
  "@context": [
    "https://www.w3.org/ns/credentials/v2",
    "https://test.uncefact.org/vocabulary/untp/dcc/0.6.0-beta12/"
  ],
  "id": "http://localhost/credentials/untp-dcc-simple.json",
  "issuer": {
    "type": [
      "CredentialIssuer"
    ],
    "id": "did:web:identifiers.electronic-certifier.com",
    "name": "Electronic Certifier Pty Ltd"
  },
  "validFrom": "2024-03-15T12:00:00Z",
  "validUntil": "2034-03-15T12:00:00Z",
  "credentialSubject": {
    "type": [
      "ConformityAttestation",
      "Attestation"
    ],
    "id": "https://sample-certifiers.com/attestations/12345",
    "name": "Carbon Lifecycle assessment 12345567",
    "assessorLevel": "3rdParty",
    "assessmentLevel": "Accredited",
    "attestationType": "certification",
    "description": "A life-cycle assessment of the battery  emissions intensity according to the Global Battery Alliance rule-book.",
    "issuedToParty": {
      "id": "https://abr.business.gov.au/ABN/View?abn=90664869327",
      "name": "Battery Company Pty Ltd.",
      "registeredId": "90664869327",
      "idScheme": {
        "type": [
          "IdentifierScheme"
        ],
        "id": "https://id.gs1.org/01/",
        "name": "Global Trade Identification Number (GTIN)"
      }
    },
    "assessment": [
      {
        "type": [
          "ConformityAssessment",
          "Declaration"
        ],
        "assessmentDate": "2024-03-15",
        "id": "https://exampleCAB.com/38f73303-a39e-45a7-b8b7-e73517548f27/01",
        "assessedProduct": [
          {
            "product": {
              "id": "https://id.gs1.org/01/09520123456788/21/12345",
              "name": "EV battery 300Ah",
              "registeredId": "09520123456788.21.12345",
              "idScheme": {
                "type": [
                  "IdentifierScheme"
                ],
                "id": "https://id.gs1.org/01/",
                "name": "Global Trade Identification Number (GTIN)"
              }
            },
            "IDverifiedByCAB": true
          }
        ],
        "assessmentCriteria": [
          {
            "id": "https://www.globalbattery.org/media/publications/gba-rulebook-v2.0-master.pdf#BatteryAssembly",
            "name": "GBA Battery rule book v2.0 battery assembly guidelines",
            "description": "The battery assembly guidelines from the Global Battery Alliance rule book v2.0."
          }
        ],
        "declaredValue": [
          {
            "metricName": "GHG emissions intensity",
            "metricValue": {
              "value": 10,
              "unit": "KGM"
            },
            "score": "BB",
            "accuracy": 0.05
          }
        ],
        "conformance": true,
        "conformityTopic": "environment.emissions"
      },
      {
        "type": [
          "ConformityAssessment",
          "Declaration"
        ],
        "assessmentDate": "2024-03-15",
        "id": "https://exampleCAB.com/38f73303-a39e-45a7-b8b7-e73517548f27/01",
        "assessedProduct": [
          {
            "product": {
              "id": "https://id.gs1.org/01/09520123456788/21/12345",
              "name": "EV battery 300Ah",
              "registeredId": "09520123456788.21.12345",
              "idScheme": {
                "type": [
                  "IdentifierScheme"
                ],
                "id": "https://id.gs1.org/01/",
                "name": "Global Trade Identification Number (GTIN)"
              }
            },
            "IDverifiedByCAB": true
          }
        ],
        "assessmentCriteria": [
          {
            "id": "https://www.globalbattery.org/media/publications/gba-rulebook-v2.0-master.pdf#BatteryDisposal",
            "name": "GBA Battery rule book v2.0 battery disposal guidelines",
            "description": "The battery disposal guidelines from the Global Battery Alliance rule book v2.0"
          },
          {
            "id": "https://www.globalbattery.org/media/publications/gba-rulebook-v2.0-master.pdf#BatteryRecycling",
            "name": "GBA Battery rule book v2.0 battery recycling guidelines",
            "description": "The battery recycling guidelines from the Global Battery Alliance rule book v2.0"
          }
        ],
        "conformance": true,
        "conformityTopic": "environment.waste"
      }
    ]
  }
}
